{"schema":"sdp-governance-inbox/2","projectRef":"pg-owner-lab","checkoutId":"e499e843-c777-40ae-a90c-f4e4836af842","generation":"a6db29e0f60ebe1b70762c474346af462ce493913faf8da14b6008fa4228b87f","inspectedAt":"2026-10-24T08:52:19.096045635Z","scope":"report-receipts-in-selected-checkout","consumption":"acknowledgement-recorded-separately","reports":[{"acknowledgement":{"request":{"schema":"sdp-governance-report-acknowledgement/1","projectRef":"pg-owner-lab","checkoutId":"e499e843-c777-40ae-a90c-f4e4836af842","operationId":"e256639b-d6d9-44dd-bb44-3fb9c9fc791b","runId":"be00db9f-4e12-4d8e-8728-9fa367450065","reportId":"dabffc1f-9e82-48a1-beaa-dd8973e924db","reportedRevision":21,"inputRevision":"73390a48f39fd65e6d0d428df1fcb3f3d61f9ed7de82818968308b2629c703f9","expectedRevision":24,"expectedGeneration":"eb64e77abab15a5af9534ae2384d6908eabdbca11244dc0781ee79c839a3d56a","coordinator":"native-lab-leader","note":"L2: Receipt only of the FormatLabel worker report. Delivery is reported; this acknowledgement does not verify implementation, accept or complete the assignment, approve design or authorize continuation. Independent review and owner acceptance remain."},"recordedAt":"2026-10-24T08:49:25.375642147Z"},"acknowledgementId":"e256639b-d6d9-44dd-bb44-3fb9c9fc791b","id":"dabffc1f-9e82-48a1-beaa-dd8973e924db","runId":"be00db9f-4e12-4d8e-8728-9fa367450065","reportedRevision":21,"inputRevision":"73390a48f39fd65e6d0d428df1fcb3f3d61f9ed7de82818968308b2629c703f9","selection":{"card":"SDP/KanBan/active/leader-trial.md","plan":"SDP/Maintenance/LeaderTrial/Plan.md","session":"SDP/Sessions/leader-trial.md","authority":"SDP/leader-trial-authority.md","step":"S1"},"outcome":"Implement and test FormatLabel in the native PG lab, then report for Project Leader processing","text":"Implemented MAINT-PGLAB-0002 M1 / SESSION-PGLAB-0002 S1 / KB-PGLAB-002 under SDP/leader-trial-authority.md. Candidate is uncommitted HEAD f66e65ec522ed19c8dc31c4216bf28697cada2f0 plus new format.go (SHA256 863625be1fe85c0208b5b45a1e4a00c3c06d16bf3b28d9059caf65848c53cbd7) and format_test.go (SHA256 e1ae8342fe73b9d48b0f04ebd1fed011f5667510ca30f858e5cbb2b2fb18c980). FormatLabel calls NormalizeLabel(input), returns empty for empty normalized input, otherwise prefix + ': ' + normalized input. Ten table-driven cases cover empty/ASCII and Unicode whitespace-only input, ASCII and Unicode boundaries, interior tabs/whitespace and case, non-whitespace Unicode boundaries, empty prefix, and exact prefix bytes including NUL/invalid UTF-8. Go go1.27.1 linux/amd64; GOCACHE=/tmp/pg-lab-go-cache go test ./... passed (pgi3pilot ok, cmd/label has no test files); gofmt applied and git diff --check passed. Same-context source inspection only. Initial working tree clean; final git status shows only the two permitted new files, all tracked files unchanged. No delegation, dependency changes, host setting changes, commits, canonical record writes or publication. No observed implementation gaps; existing behavioral authority remains accurate. Remaining gates: external coordinator verification, applicable independent review, Project Leader report processing, controller evidence publication and any required owner disposition. Proposed next phase is verify. Report is implementation evidence, not independent approval, owner acceptance or completion.","currentRevision":24,"currentState":"verifying","coverage":"known","conditions":[]}]}
